{
  "object_type": "LEARNING_MODULE_PROFILE",
  "lesson_id": "grade4-book1-lesson1",
  "source_master_version": "SM-001",
  "approved_selection_version": "ATS-001",
  "lkb_version": "LKB-001",
  "version": "LM-001",
  "status": "TEACHER_REVIEW",
  "teacher_confirmation_status": "WAITING_TEACHER",
  "modules": [
    {
      "module_id": "LM-SHAPE-001",
      "module_type": "shape_comparison",
      "source_node_refs": ["LKB:NODE-CHAR-001"],
      "content_layer": "LEARNING_EXTENSION",
      "student_content": { "task": "比較共同部件與差異部件" },
      "teacher_layer": { "answer": "教師版答案與判讀" },
      "answer_visibility": "TEACHER_ONLY",
      "enabled": true
    }
  ],
  "derived_from": {
    "direct_parent": "APPROVED_TEACHING_SELECTION:ATS-001",
    "lineage": ["SOURCE_MASTER:SM-001", "APPROVED_TEACHING_SELECTION:ATS-001", "LKB:LKB-001"]
  }
}
